{
  "schema_version": "reagent.workflow-capsule-reference/v0.1",
  "workflow_instance_id": "wfi-33333333333333333333333333333333",
  "workflow_definition_id": "literature-search-local-experimental",
  "workflow_definition_version": "0.3.0",
  "capsule_id": "capsule-44444444444444444444444444444444",
  "capsule_version": "0.5.0",
  "capsule_definition_checksum": "sha256:aaaaaaaaaaaaaaaaaaaaaaaaaaaaaaaaaaaaaaaaaaaaaaaaaaaaaaaaaaaaaaaa",
  "installation_mode": "WORKSPACE_INSTALLED",
  "relative_path": "capsules/literature-search-local-experimental/wfi-33333333333333333333333333333333/0.5.0",
  "desired_state": "ACTIVE"
}
